{
  "$schema": "../schema/combat-presentation-4.schema.json",
  "schemaVersion": 4,
  "weapon": {
    "id": "pistol",
    "readyFrame": "PISGA0",
    "fireFrames": ["PISGB0", "PISGC0", "PISGD0", "PISGE0"],
    "frameMilliseconds": 70,
    "fireSound": "DSPISTOL"
  },
  "player": {
    "painSound": "DSPLPAIN",
    "deathSound": "DSPLDETH"
  },
  "pickups": {
    "collectSound": "DSITEMUP"
  },
  "doors": {
    "normalOpeningSound": "DSDOROPN",
    "normalClosingSound": "DSDORCLS",
    "blazeOpeningSound": "DSBDOPN",
    "blazeClosingSound": "DSBDCLS"
  },
  "combatants": [
    {
      "actor": "zombieman",
      "animations": {
        "walkFrames": ["POSSA1", "POSSB1", "POSSC1", "POSSD1"],
        "attackFrames": ["POSSE1", "POSSF1", "POSSE1"],
        "painFrames": ["POSSG1"],
        "deathFrames": ["POSSH0", "POSSI0", "POSSJ0", "POSSK0", "POSSL0"],
        "frameMilliseconds": 140
      },
      "sounds": {
        "sightSounds": ["DSPOSIT1", "DSPOSIT2", "DSPOSIT3"],
        "attackSound": "DSPISTOL",
        "painSound": "DSPOPAIN",
        "deathSounds": ["DSPODTH1", "DSPODTH2", "DSPODTH3"]
      }
    }
  ],
  "hud": {
    "digits": [
      "STTNUM0",
      "STTNUM1",
      "STTNUM2",
      "STTNUM3",
      "STTNUM4",
      "STTNUM5",
      "STTNUM6",
      "STTNUM7",
      "STTNUM8",
      "STTNUM9"
    ],
    "percent": "STTPRCNT"
  }
}
